rank	research_question_id	research_question	axes	scientific_impact_weight	coverage_feasibility_score	combined_priority_score	testability_class	proposed_figure
1	RQ2	Does UTI induce an inflammatory carbon-use state integrating glycolysis, lactate-HIF1A, pentose-phosphate, insulin-IRS and mTOR signaling while suppressing oxidative metabolism?	carbohydrate_inflammatory_carbon;insulin_irs_signaling	5	1.0	1.0	testable_now_high_priority	Figure_8
2	RQ5	Do insulin, IRS and adipokine programs link pregnancy-associated inflammation, carbohydrate metabolism and recurrent UTI susceptibility?	insulin_irs_signaling;adipokine_signaling;carbohydrate_inflammatory_carbon	5	1.0	1.0	testable_now_high_priority	Figure_8
3	RQ6	Do tryptophan-kynurenine, arginine-nitric-oxide, glutamine and one-carbon programs define immune activation and nutrient-handling states relevant to UPEC persistence?	amino_acid_metabolism;nucleotide_nad_nitrogen	5	1.0	1.0	testable_now_high_priority	Figure_9
4	RQ3	Which complement initiation and amplification route dominates recurrent UTI, pregnancy-associated UTI, urine inflammatory states and UPEC-responsive single cells?	complement_architecture;immune_context_anchors	5	0.9806	0.9922	testable_now_high_priority	Figure_10
5	RQ1	Do pregnancy-associated UTI states shift from progesterone-supportive and steroid-conversion programs toward androgenic, glucocorticoid, inflammatory or steroid-catabolic programs?	steroid_cholesterol_endocrine;immune_context_anchors	5	0.9533	0.9813	testable_now_high_priority	Figure_7
6	RQ4	Do lipid remodeling, inflammatory eicosanoids and ferroptosis-linked lipid peroxidation connect UTI inflammation with altered steroid precursor availability?	lipid_metabolism;steroid_cholesterol_endocrine	5	0.9533	0.9813	testable_now_high_priority	Figure_7
7	RQ7	Are catecholamine-adjacent stress, iron-sequestration and redox programs linked to UPEC-responsive inflammatory biology?	catecholamine_stress_adjacent;immune_context_anchors	4	1.0	0.88	testable_now_high_priority	Figure_9_or_supplement
8	RQ8	Does UTI activate nucleotide turnover, NAD consumption, purine oxidation and nitrogen-handling programs that track inflammatory-cell proliferation and oxidative stress?	nucleotide_nad_nitrogen;immune_context_anchors	4	1.0	0.88	testable_now_high_priority	Figure_9
