item_id	item_label	current_or_provisional_text	requested_user_input	status	user_response
author_order	Final author list and order		Provide the exact author names in publication order, including initials and diacritics.	USER_INPUT_REQUIRED	
affiliation_mapping	Affiliations and author-affiliation mapping		Provide the numbered affiliation list and map each author to the correct affiliation numbers.	USER_INPUT_REQUIRED	
corresponding_author	Corresponding-author details		Provide corresponding-author name, institutional postal address, email and ORCID if used.	USER_INPUT_REQUIRED	
repository	Code/data repository statement	All analysis and manuscript-generation steps were implemented as reproducible scripts under `10_scripts/` in the project directory. Frozen figure assets, source-value tables, audit manifests and checksum records are retained in the corresponding phase-specific output directories. A public repository archive will be finalized before journal submission.	Provide the final public repository URL and DOI/archival identifier, or confirm that this remains pending.	USER_INPUT_REQUIRED	
credit_contributions	CRediT author contributions	Reuben S. Maghembe conceived the study, designed the computational workflow, performed the integrative analysis, interpreted the results, and drafted the manuscript. Final author-contribution statements should be updated after co-author review and contribution confirmation.	Provide or confirm the contribution roles for every author.	USER_INPUT_REQUIRED	
competing_interests	Competing-interest declaration	The competing-interest statement should be finalized before submission.	Provide the final declaration exactly as it should appear in the manuscript.	USER_INPUT_REQUIRED	
acknowledgements	Acknowledgements	Acknowledgements should be added before submission.	Provide the final acknowledgement text, including non-author assistance and infrastructure support.	USER_INPUT_REQUIRED	
funding_confirmation	Funding statement confirmation	This work was supported by the Global Infectious Diseases Research Training Program, a collaboration between Kibong'oto Infectious Diseases Hospital and the University of Virginia, under the Fogarty International Center, National Institutes of Health grant D43 TW012247.	Confirm the current funding statement and grant wording before final insertion.	CONFIRMATION_REQUIRED	
